[
  {
    "id": "REC-001",
    "area": "input_damping",
    "severity": "medium",
    "confidence": 0.6,
    "problem": "The input network can form a lightly-damped LC that converts switching energy into conducted emission peaks near the switching harmonics.",
    "evidence": [
      "R-002: guidance on conducted EMI mitigation for power converters (recommend using damping/filtering at input nodes).",
      "engineering_estimate: measured simulation band peak (v_meas_band_peak_dbuv_150000_30000000 = 66.20 dB\u03bcV) indicates significant conducted energy in the 150 kHz\u201330 MHz band that input damping may reduce."
    ],
    "proposed_change": {
      "type": "add_damping",
      "description": "Add a small RC damping branch at the converter input (across or in series with input capacitor banks) to damp high-frequency resonances between input inductance/traces and input capacitance.",
      "values": {
        "R": "0.5-3.3 ohm",
        "C": "100 nF - 1 uF"
      }
    },
    "simulation_required": true,
    "user_action": "Simulate the input network with the suggested RC values (sweep R and C) and compare the 150 kHz\u201330 MHz conducted spectrum; verify changes in a lab LISN measurement.",
    "limitations": [
      "No layout available \u2014 the effectiveness depends on actual trace/plane inductances and cable routing.",
      "Component ESR/ESL curves were not provided and will affect optimal R/C choices."
    ],
    "sources": [
      "R-002"
    ],
    "llm_generated": true,
    "citations": [
      "SRC-001"
    ]
  },
  {
    "id": "REC-002",
    "area": "common_mode_filter",
    "severity": "high",
    "confidence": 0.5,
    "problem": "Common\u2011mode currents generated by the switching node can couple onto input/output cabling and show up as large conducted peaks.",
    "evidence": [
      "SRC-028: note that inductance for differential currents can be low while common\u2011mode impedance remains high (useful property of CM chokes to block CM currents).",
      "R-010: guidance about cables and board traces indicates that cable routing and insertion of CM impedance is effective at reducing conducted currents on wiring harnesses."
    ],
    "proposed_change": {
      "type": "add_filter",
      "description": "Add a dedicated input common\u2011mode choke (or increase CM impedance) ahead of the converter input to raise common\u2011mode impedance seen by cable currents while preserving differential power transfer.",
      "values": {
        "Lcm": "10-200 uH (start coarse sweep)",
        "I_rated": ">= 2 A DC (with margin)"
      }
    },
    "simulation_required": true,
    "user_action": "Model a CM choke in the input path (sweep Lcm across the given range) and measure conducted CM spectrum; validate choke nonlinearities and saturation with expected DC current.",
    "limitations": [
      "No layout available \u2014 coupling to nearby conductors and cable routing will change CM impedance in practice.",
      "Datasheet nonlinearity and inter-winding capacitance of candidate chokes were not available and must be considered during selection."
    ],
    "sources": [
      "R-010"
    ],
    "llm_generated": true,
    "citations": [
      "SRC-013",
      "SRC-028"
    ]
  },
  {
    "id": "REC-003",
    "area": "switch_node_snubber",
    "severity": "medium",
    "confidence": 0.55,
    "problem": "Switch-node ringing and high dv/dt at the switching node can generate high-frequency harmonics that increase conducted emission peaks.",
    "evidence": [
      "R-001: general schematic/EMC guidance for switching converters recommends local damping at switching nodes (snubbers/suppression networks) to reduce high\u2011frequency content.",
      "R-002: conducted EMI guidance supports damping of switching-node resonances to lower emissions coupled to the input."
    ],
    "proposed_change": {
      "type": "add_damping",
      "description": "Add a snubber on the switch node (RC or RCD style) to damp switching-edge ringing and reduce high-frequency spectral content.",
      "values": {
        "R": "10-100 ohm",
        "C": "100 pF - 10 nF"
      }
    },
    "simulation_required": true,
    "user_action": "Simulate the switch-node waveform and spectral density while sweeping snubber R and C over the given ranges to find the best trade-off between damping, switching losses, and conducted spectrum.",
    "limitations": [
      "No layout available \u2014 snubber placement relative to the switch node critically affects performance.",
      "Switching-device parasitics and datasheet capacitances were not provided; these will affect snubber sizing."
    ],
    "sources": [
      "R-001",
      "R-002"
    ],
    "llm_generated": true,
    "citations": [
      "SRC-026",
      "SRC-001"
    ]
  },
  {
    "id": "REC-004",
    "area": "layout",
    "severity": "high",
    "confidence": 0.4,
    "problem": "Large switching loop area and poor return routing will increase loop inductance and conducted/coupled emissions.",
    "evidence": [
      "R-010: guidance on cabling and traces emphasises minimizing switching loop area and keeping return paths close to reduce loop inductance and emissions.",
      "R-008: stack-up recommendations indicate that a proper plane pair and controlled return reduce loop inductance and provide a low-impedance return at high frequencies."
    ],
    "proposed_change": {
      "type": "layout_change",
      "description": "Re-route power and return traces to minimize the high\u2011di/dt switching loop (place input caps close to the switch, use a dedicated return plane, and keep hot loop area as small as possible)."
    },
    "simulation_required": true,
    "user_action": "When a PCB layout is available, re-run EMC-coupled simulations with the updated loop geometry and re-evaluate conducted spectrum; verify in hardware with controlled cabling.",
    "limitations": [
      "No layout available \u2014 this recommendation is layout-dependent and cannot be fully validated without board geometry.",
      "Stack-up was provided but component placement/trace widths/heights are unknown, so predicted loop inductances are estimates."
    ],
    "sources": [
      "R-010",
      "R-008"
    ],
    "llm_generated": true,
    "citations": [
      "SRC-013",
      "SRC-034"
    ]
  },
  {
    "id": "REC-005",
    "area": "parametric_sweep",
    "severity": "info",
    "confidence": 0.65,
    "problem": "Sensitivity of the conducted spectrum to parasitic variations is unknown; single-point sims may miss worst-case emission scenarios.",
    "evidence": [
      "engineering_estimate: parasitic trace/plane/via values are provided in the analysis (trace L/C and plane pair C) and should be swept to find worst-case peaks.",
      "R-002: general conducted-EMI guidance suggests varying parasitics and component tolerances during pre-compliance simulation to find sensitive resonances."
    ],
    "proposed_change": {
      "type": "sweep",
      "description": "Perform parametric sweeps of key parasitics (trace inductance, plane-pair capacitance, via inductance) and damping/filter values to identify worst-case spectral peaks and effective mitigations.",
      "values": {
        "trace/L": "8.33e-9 - 2.5e-8 H",
        "trace/C": "1.88e-12 - 3.48e-12 F",
        "plane_pair/C": "1.52e-11 - 2.38e-11 F",
        "via/L": "9.1e-10 - 1.82e-9 H",
        "series_R_sweep": "0 - 5 ohm"
      }
    },
    "simulation_required": true,
    "user_action": "Run the recommended sweeps in LTspice (or equivalent) and plot the 150 kHz\u201330 MHz conducted spectrum for each case to locate sensitive resonances and quantify mitigation benefit.",
    "limitations": [
      "No layout available \u2014 parasitic ranges are estimates and actual board geometry may fall outside these ranges.",
      "Component parasitic models (ESL/ESR frequency dependence) were not supplied and should be added for higher-fidelity sweeps."
    ],
    "sources": [
      "R-002"
    ],
    "llm_generated": true,
    "citations": [
      "SRC-001"
    ]
  },
  {
    "id": "REC-006",
    "area": "testbench_measurement",
    "severity": "medium",
    "confidence": 0.6,
    "problem": "Simulation-only results need verification with a LISN-style testbench and replicated cable conditions to evaluate real conducted emissions.",
    "evidence": [
      "R-002: recommends lab-style conducted emission test setups (LISN/cable conditions) for verification after pre-compliance simulation.",
      "engineering_estimate: current simulated band peak (66.20 dB\u03bcV) motivates adding a LISN model to the testbench to compare simulated vs measured behavior."
    ],
    "proposed_change": {
      "type": "include_in_testbench",
      "description": "Include a LISN or equivalent input impedance model and representative cable models in the simulation testbench and plan lab LISN measurements with the same cable harness topology."
    },
    "simulation_required": true,
    "user_action": "Add a LISN input model and cable impedance into the simulation, rerun spectral scans 150 kHz\u201330 MHz, and then perform equivalent hardware LISN measurements for correlation.",
    "limitations": [
      "No layout available \u2014 LISN/cable coupling to the board depends on connector placement and harness routing.",
      "Accurate cable/LISN models and measurement fixtures are required for meaningful correlation."
    ],
    "sources": [
      "R-002"
    ],
    "llm_generated": true,
    "citations": [
      "SRC-001"
    ]
  }
]